{
  "_links": {
    "self": {
      "href": "https://lod.onderwijsregistratie.nl/api/rio/v1/vavo-opleidingserkenningen/5250"
    },
    "voOpleiding": {
      "href": "https://lod.onderwijsregistratie.nl/api/rio/v1/vo-opleidingen?vavoOpleidingserkenning=http://lod.onderwijsregistratie.nl/rio/id/MboOpleidingserkenning/97552"
    },
    "vavoOnderwijslicentie": {
      "href": "https://lod.onderwijsregistratie.nl/api/rio/v1/vavo-onderwijslicenties?vavoOpleidingserkenning=http://lod.onderwijsregistratie.nl/rio/id/MboOpleidingserkenning/97552"
    }
  },
  "uri": "http://lod.onderwijsregistratie.nl/rio/id/VavoOpleidingserkenning/5250",
  "ingangsdatum": "2008-08-01",
  "einddatum": "2013-08-01",
  "wet": "WEB",
  "ministerie" : "EZ",
  "opleidingsstelsel": "KSE",
  "opleidingcode": "5250"
}